{
  "schema_version": "topic-insights-v1",
  "generated_at": "2026-10-25T02:13:05.078585Z",
  "app": {
    "id": "shopify",
    "name": "Shopify",
    "source_app_id": "shopify-2ec24a3c",
    "pipeline_run_slug": "shopify-c3a45cb7"
  },
  "tagging": {
    "method": "semantic_similarity",
    "topic_representation": "description",
    "embedding_model": "sentence-transformers/all-MiniLM-L6-v2",
    "taxonomy_version": "e3474efd0213e96b2439183999b45227ecab73a85bf00cb0617ed46b30bbf5f4",
    "global_cosine_threshold": 0.5,
    "topic_ids_are_app_scoped": true
  },
  "summary": {
    "total_reviews": 26995,
    "reviews_with_topics": 2116,
    "tagging_coverage_percent": 7.8385,
    "average_stars": 4.4433,
    "rated_review_count": 26995,
    "missing_rating_count": 0,
    "star_distribution": [
      {
        "stars": 1,
        "count": 2099
      },
      {
        "stars": 2,
        "count": 626
      },
      {
        "stars": 3,
        "count": 1132
      },
      {
        "stars": 4,
        "count": 2491
      },
      {
        "stars": 5,
        "count": 20647
      }
    ],
    "earliest_review_date": "2024-07-26",
    "latest_review_date": "2026-05-17",
    "missing_date_count": 0
  },
  "monthly_reviews": [
    {
      "month": "2024-07",
      "review_count": 255,
      "partial_month": true,
      "partial_reasons": [
        "first_observed_review_after_month_start"
      ],
      "insufficient_review_volume": false
    },
    {
      "month": "2024-08",
      "review_count": 1269,
      "partial_month": false,
      "partial_reasons": [],
      "insufficient_review_volume": false
    },
    {
      "month": "2024-09",
      "review_count": 1144,
      "partial_month": false,
      "partial_reasons": [],
      "insufficient_review_volume": false
    },
    {
      "month": "2024-10",
      "review_count": 1299,
      "partial_month": false,
      "partial_reasons": [],
      "insufficient_review_volume": false
    },
    {
      "month": "2024-11",
      "review_count": 1424,
      "partial_month": false,
      "partial_reasons": [],
      "insufficient_review_volume": false
    },
    {
      "month": "2024-12",
      "review_count": 1556,
      "partial_month": false,
      "partial_reasons": [],
      "insufficient_review_volume": false
    },
    {
      "month": "2025-01",
      "review_count": 1421,
      "partial_month": false,
      "partial_reasons": [],
      "insufficient_review_volume": false
    },
    {
      "month": "2025-02",
      "review_count": 1223,
      "partial_month": false,
      "partial_reasons": [],
      "insufficient_review_volume": false
    },
    {
      "month": "2025-03",
      "review_count": 1258,
      "partial_month": false,
      "partial_reasons": [],
      "insufficient_review_volume": false
    },
    {
      "month": "2025-04",
      "review_count": 1299,
      "partial_month": false,
      "partial_reasons": [],
      "insufficient_review_volume": false
    },
    {
      "month": "2025-05",
      "review_count": 1381,
      "partial_month": false,
      "partial_reasons": [],
      "insufficient_review_volume": false
    },
    {
      "month": "2025-06",
      "review_count": 1283,
      "partial_month": false,
      "partial_reasons": [],
      "insufficient_review_volume": false
    },
    {
      "month": "2025-07",
      "review_count": 1349,
      "partial_month": false,
      "partial_reasons": [],
      "insufficient_review_volume": false
    },
    {
      "month": "2025-08",
      "review_count": 1320,
      "partial_month": false,
      "partial_reasons": [],
      "insufficient_review_volume": false
    },
    {
      "month": "2025-09",
      "review_count": 1247,
      "partial_month": false,
      "partial_reasons": [],
      "insufficient_review_volume": false
    },
    {
      "month": "2025-10",
      "review_count": 1211,
      "partial_month": false,
      "partial_reasons": [],
      "insufficient_review_volume": false
    },
    {
      "month": "2025-11",
      "review_count": 1146,
      "partial_month": false,
      "partial_reasons": [],
      "insufficient_review_volume": false
    },
    {
      "month": "2025-12",
      "review_count": 1303,
      "partial_month": false,
      "partial_reasons": [],
      "insufficient_review_volume": false
    },
    {
      "month": "2026-01",
      "review_count": 1159,
      "partial_month": false,
      "partial_reasons": [],
      "insufficient_review_volume": false
    },
    {
      "month": "2026-02",
      "review_count": 1023,
      "partial_month": false,
      "partial_reasons": [],
      "insufficient_review_volume": false
    },
    {
      "month": "2026-03",
      "review_count": 1125,
      "partial_month": false,
      "partial_reasons": [],
      "insufficient_review_volume": false
    },
    {
      "month": "2026-04",
      "review_count": 882,
      "partial_month": false,
      "partial_reasons": [],
      "insufficient_review_volume": false
    },
    {
      "month": "2026-05",
      "review_count": 418,
      "partial_month": true,
      "partial_reasons": [
        "last_observed_review_before_month_end"
      ],
      "insufficient_review_volume": false
    }
  ],
  "topics": [
    {
      "topic_id": "topic-0027",
      "name": "Failure to identify songs",
      "definition": "The app cannot identify songs or artists, including older music, classics, and non-mainstream recordings.",
      "parent_category_id": "music-recognition-620417",
      "parent_category_name": "Music Recognition",
      "rank_by_review_count": 1,
      "review_count": 1233,
      "percentage_of_all_reviews": 4.5675,
      "average_stars": 3.163,
      "rated_review_count": 1233,
      "missing_rating_count": 0,
      "star_distribution": [
        {
          "stars": 1,
          "count": 395
        },
        {
          "stars": 2,
          "count": 119
        },
        {
          "stars": 3,
          "count": 96
        },
        {
          "stars": 4,
          "count": 136
        },
        {
          "stars": 5,
          "count": 487
        }
      ],
      "mean_accepted_cosine_similarity": 0.5586,
      "missing_date_count": 0,
      "monthly": [
        {
          "month": "2024-07",
          "review_count": 11,
          "total_app_reviews": 255,
          "percentage_of_monthly_reviews": 4.3137,
          "average_stars": 2.0909,
          "rated_review_count": 11,
          "change_percentage_points": null,
          "partial_month": true,
          "insufficient_review_volume": false
        },
        {
          "month": "2024-08",
          "review_count": 62,
          "total_app_reviews": 1269,
          "percentage_of_monthly_reviews": 4.8857,
          "average_stars": 2.9032,
          "rated_review_count": 62,
          "change_percentage_points": 0.572,
          "partial_month": false,
          "insufficient_review_volume": false
        },
        {
          "month": "2024-09",
          "review_count": 56,
          "total_app_reviews": 1144,
          "percentage_of_monthly_reviews": 4.8951,
          "average_stars": 3.5357,
          "rated_review_count": 56,
          "change_percentage_points": 0.0094,
          "partial_month": false,
          "insufficient_review_volume": false
        },
        {
          "month": "2024-10",
          "review_count": 52,
          "total_app_reviews": 1299,
          "percentage_of_monthly_reviews": 4.0031,
          "average_stars": 3.4038,
          "rated_review_count": 52,
          "change_percentage_points": -0.892,
          "partial_month": false,
          "insufficient_review_volume": false
        },
        {
          "month": "2024-11",
          "review_count": 56,
          "total_app_reviews": 1424,
          "percentage_of_monthly_reviews": 3.9326,
          "average_stars": 3.1964,
          "rated_review_count": 56,
          "change_percentage_points": -0.0705,
          "partial_month": false,
          "insufficient_review_volume": false
        },
        {
          "month": "2024-12",
          "review_count": 64,
          "total_app_reviews": 1556,
          "percentage_of_monthly_reviews": 4.1131,
          "average_stars": 3.3281,
          "rated_review_count": 64,
          "change_percentage_points": 0.1805,
          "partial_month": false,
          "insufficient_review_volume": false
        },
        {
          "month": "2025-01",
          "review_count": 75,
          "total_app_reviews": 1421,
          "percentage_of_monthly_reviews": 5.278,
          "average_stars": 3.1867,
          "rated_review_count": 75,
          "change_percentage_points": 1.1649,
          "partial_month": false,
          "insufficient_review_volume": false
        },
        {
          "month": "2025-02",
          "review_count": 42,
          "total_app_reviews": 1223,
          "percentage_of_monthly_reviews": 3.4342,
          "average_stars": 2.8333,
          "rated_review_count": 42,
          "change_percentage_points": -1.8438,
          "partial_month": false,
          "insufficient_review_volume": false
        },
        {
          "month": "2025-03",
          "review_count": 49,
          "total_app_reviews": 1258,
          "percentage_of_monthly_reviews": 3.8951,
          "average_stars": 3.2653,
          "rated_review_count": 49,
          "change_percentage_points": 0.4609,
          "partial_month": false,
          "insufficient_review_volume": false
        },
        {
          "month": "2025-04",
          "review_count": 74,
          "total_app_reviews": 1299,
          "percentage_of_monthly_reviews": 5.6967,
          "average_stars": 3.1081,
          "rated_review_count": 74,
          "change_percentage_points": 1.8016,
          "partial_month": false,
          "insufficient_review_volume": false
        },
        {
          "month": "2025-05",
          "review_count": 65,
          "total_app_reviews": 1381,